created,id,testo,rt,rt_names,location,cluster,hashtag,mention,text_clean,tokenized_text,sentiment_text,emotion,sentiment,neg,neu,pos,compound,new_sent
Sat Jul 30 08:27:13 +0000 2022,1553296140619112451,"Serietà, responsabilità e coraggio per cambiare. Come quando abbiamo governato il Paese nel momento più difficile. Con chi non conta, per chi non ha voce. https://t.co/pviG6Bl1Eg",568,[],,GiuseppeConte,[],[],serietà responsabilità e coraggio per cambiare come quando abbiamo governato il paese nel momento più difficile con chi non conta per chi non ha voce ,"['serietà', 'responsabilità', 'coraggio', 'cambiare', 'quando', 'avere', 'governare', 'paese', 'momento', 'difficile', 'conta', 'avere', 'voce']",serietà responsabilità coraggio cambiare quando avere governare paese momento difficile conta avere voce,sadness,"{'neg': 0.449, 'neu': 0.184, 'pos': 0.367, 'compound': -0.1998}",0.449,0.184,0.367,-0.1998,negativo
Fri Jul 29 15:59:29 +0000 2022,1553047570443804672,"In bocca al lupo a @FraSilvestriM5S, nuovo capogruppo del @M5S_Camera e ai nuovi componenti del direttivo. Rimbocchiamoci le maniche e impegniamoci fino all’ultimo giorno di legislatura per aiutare famiglie e imprese. Ci aspetta un periodo davvero intenso 💪🏻",331,"[{'screen_name': 'FraSilvestriM5S', 'name': 'Francesco Silvestri', 'id': 1079313739671846912, 'id_str': '1079313739671846912', 'indices': [19, 35]}, {'screen_name': 'M5S_Camera', 'name': 'M5S Camera', 'id': 1354935949, 'id_str': '1354935949', 'indices': [58, 69]}]",,GiuseppeConte,[],"['FraSilvestriM5S', 'M5S_Camera']",in bocca al lupo a  nuovo capogruppo del e ai nuovi componenti del direttivo rimbocchiamoci le maniche e impegniamoci fino all’ultimo giorno di legislatura per aiutare famiglie e imprese ci aspetta un periodo davvero intenso ,"['bocca', 'lupo', 'nuovo', 'capogruppo', 'nuovo', 'componente', 'direttivo', 'rimboccare', 'manica', 'impegnare', 'fino', 'ultimo', 'giorno', 'legislatura', 'aiutare', 'famiglia', 'impresa', 'aspettare', 'periodo', 'davvero', 'intenso']",bocca lupo nuovo capogruppo nuovo componente direttivo rimboccare manica impegnare fino ultimo giorno legislatura aiutare famiglia impresa aspettare periodo davvero intenso,joy,"{'neg': 0.185, 'neu': 0.342, 'pos': 0.473, 'compound': 0.6632}",0.185,0.342,0.473,0.6632,positivo
Fri Jul 29 09:58:02 +0000 2022,1552956608140959745,"Ci tengo a essere sincero con tutti voi: vi spiego quello che è successo in questi giorni, quello che siamo e quello che non siamo. Abbiamo le idee chiare per l'Italia https://t.co/O6cA54X6cp",524,[],,GiuseppeConte,[],[],ci tengo a essere sincero con tutti voi vi spiego quello che è successo in questi giorni quello che siamo e quello che non siamo abbiamo le idee chiare per l italia ,"['tenere', 'essere', 'sincero', 'spiegare', 'essere', 'succedere', 'giorno', 'essere', 'essere', 'avere', 'idea', 'chiaro', 'italia']",tenere essere sincero spiegare essere succedere giorno essere essere avere idea chiaro italia,joy,"{'neg': 0.286, 'neu': 0.238, 'pos': 0.476, 'compound': 0.4588}",0.286,0.238,0.476,0.4588,positivo
Fri Jul 29 07:20:06 +0000 2022,1552916863721607169,La mia intervista poco fa a #NonStopNews su @rtl1025: https://t.co/yxKsn1IA2T,243,"[{'screen_name': 'rtl1025', 'name': 'RTL 102.5', 'id': 56341776, 'id_str': '56341776', 'indices': [44, 52]}]",,GiuseppeConte,['NonStopNews'],['rtl1025'],la mia intervista poco fa a su  ,"['intervista', 'poco', 'fare']",intervista poco fare,joy,"{'neg': 0.333, 'neu': 0.0, 'pos': 0.667, 'compound': 0.25}",0.333,0.0,0.667,0.25,positivo
Fri Jul 29 06:21:16 +0000 2022,1552902056519897088,Fra poco a #NonStopNews su @rtl1025 https://t.co/ZKtuWMaiEt,100,"[{'screen_name': 'rtl1025', 'name': 'RTL 102.5', 'id': 56341776, 'id_str': '56341776', 'indices': [27, 35]}]",,GiuseppeConte,['NonStopNews'],['rtl1025'],fra poco a su ,"['fra', 'poco']",fra poco,anger,"{'neg': 0.667, 'neu': 0.333, 'pos': 0.0, 'compound': -0.25}",0.667,0.333,0.0,-0.25,negativo
Thu Jul 28 17:37:57 +0000 2022,1552709960592678921,"RT @Mov5Stelle: Siamo stati i primi a mettere nero su bianco l'azzeramento dell'Iva sui beni di prima necessità come pane, pasta, carne, la…",378,"[{'screen_name': 'Mov5Stelle', 'name': 'MoVimento 5 Stelle', 'id': 289400495, 'id_str': '289400495', 'indices': [3, 14]}]",,GiuseppeConte,[],['Mov5Stelle'],rt  siamo stati i primi a mettere nero su bianco l azzeramento dell iva sui beni di prima necessità come pane pasta carne la…,"['rt', 'essere', 'essere|stare', 'primo', 'mettere', 'nero', 'bianco', 'azzeramento', 'iva', 'bene', 'primo', 'necessità', 'pane', 'pasta', 'carne']",rt essere essere|stare primo mettere nero bianco azzeramento iva bene primo necessità pane pasta carne,anger,"{'neg': 0.317, 'neu': 0.256, 'pos': 0.427, 'compound': 0.3798}",0.317,0.256,0.427,0.3798,positivo
Thu Jul 28 16:55:01 +0000 2022,1552699155356827649,"Le nostre priorità: salario minimo per chi ha stipendi da 2 o 3 euro l’ora, taglio delle tasse sul lavoro per aumentare gli stipendi, aiuti a famiglie e imprese sulle bollette.

Le priorità del centrodestra: la spartizione di collegi elettorali e posti di potere. https://t.co/cirFpTAnVf",702,[],,GiuseppeConte,[],[],"le nostre priorità salario minimo per chi ha stipendi da 2 o 3 euro l’ora taglio delle tasse sul lavoro per aumentare gli stipendi aiuti a famiglie e imprese sulle bollette 
le priorità del centrodestra la spartizione di collegi elettorali e posti di potere ","['priorità', 'salario', 'minimo', 'avere', 'stipendio', 'euro', 'ora', 'taglio', 'tassa', 'lavoro', 'aumentare', 'stipendio', 'aiuto', 'famiglia', 'impresa', 'bolletta', 'priorità', 'centrodestra', 'spartizione', 'collegio', 'elettorale', 'posto', 'potere']",priorità salario minimo avere stipendio euro ora taglio tassa lavoro aumentare stipendio aiuto famiglia impresa bolletta priorità centrodestra spartizione collegio elettorale posto potere,anger,"{'neg': 0.35, 'neu': 0.321, 'pos': 0.328, 'compound': -0.1898}",0.35,0.321,0.328,-0.1898,negativo
Wed Jul 27 17:19:56 +0000 2022,1552343040857079808,"Ci batteremo con tutte le nostre forze per voi. 
Questo è il mio, il nostro impegno. 
Saremo il #campogiusto. https://t.co/z7zZdtxi4l",788,[],,GiuseppeConte,['campogiusto'],[],"ci batteremo con tutte le nostre forze per voi 
questo è il mio il nostro impegno 
saremo il  ","['battere', 'forza', 'essere', 'impegno', 'essere']",battere forza essere impegno essere,joy,"{'neg': 0.25, 'neu': 0.25, 'pos': 0.5, 'compound': 0.25}",0.25,0.25,0.5,0.25,positivo
Wed Jul 27 12:40:51 +0000 2022,1552272806292897794,"RT @Mov5Stelle: Legge anticorruzione realizzata, taglio dei parlamentari e dei privilegi realizzato, decreto dignità contro il precariato r…",335,"[{'screen_name': 'Mov5Stelle', 'name': 'MoVimento 5 Stelle', 'id': 289400495, 'id_str': '289400495', 'indices': [3, 14]}]",,GiuseppeConte,[],['Mov5Stelle'],rt  legge anticorruzione realizzata taglio dei parlamentari e dei privilegi realizzato decreto dignità contro il precariato r…,"['rt', 'legge', 'anticorruzione', 'realizzare', 'taglio', 'parlamentare', 'privilegio', 'realizzare', 'decreto', 'dignità', 'precariato', 'r']",rt legge anticorruzione realizzare taglio parlamentare privilegio realizzare decreto dignità precariato r,anger,"{'neg': 0.125, 'neu': 0.375, 'pos': 0.5, 'compound': 0.6124}",0.125,0.375,0.5,0.6124,positivo
Wed Jul 27 09:53:51 +0000 2022,1552230778020446208,Noi saremo il campo giusto. https://t.co/uZuw6xkLnj,695,[],,GiuseppeConte,[],[],noi saremo il campo giusto ,"['essere', 'campo', 'giusto']",essere campo giusto,joy,"{'neg': 0.4, 'neu': 0.2, 'pos': 0.4, 'compound': 0.0}",0.4,0.2,0.4,0.0,neutrale
Tue Jul 26 21:45:06 +0000 2022,1552047382640173057,La mia intervista questa sera a #Filorosso: https://t.co/SSxEfyAqeN https://t.co/xa7cEMENyk,245,[],,GiuseppeConte,['Filorosso'],[],la mia intervista questa sera a  ,"['intervista', 'sera']",intervista sera,joy,"{'neg': 0.0, 'neu': 0.333, 'pos': 0.667, 'compound': 0.25}",0.0,0.333,0.667,0.25,positivo
Tue Jul 26 18:07:33 +0000 2022,1551992636814376967,Finora abbiamo ascoltato di tutto e di più. Adesso parlo io: https://t.co/Hav2Ab74iF,642,[],,GiuseppeConte,[],[],finora abbiamo ascoltato di tutto e di più adesso parlo io ,"['finora', 'avere', 'ascoltare', 'adesso', 'parlare']",finora avere ascoltare adesso parlare,joy,"{'neg': 0.5, 'neu': 0.25, 'pos': 0.25, 'compound': -0.25}",0.5,0.25,0.25,-0.25,negativo
Tue Jul 26 10:36:13 +0000 2022,1551879055007514627,Questa sera sarò ospite a #Filorosso. Dalle 21.20 su Rai 3. https://t.co/TjFElkBYlJ,414,[],,GiuseppeConte,['Filorosso'],[],questa sera sarò ospite a  dalle 21 20 su rai 3 ,"['sera', 'essere', 'ospite', '@card@', 'rai']",sera essere ospite @card@ rai,joy,"{'neg': 0.333, 'neu': 0.667, 'pos': 0.0, 'compound': -0.25}",0.333,0.667,0.0,-0.25,negativo
Sun Jul 24 10:21:34 +0000 2022,1551150592466223104,"RT @Mov5Stelle: 📰 Leggi l’intervista realizzata da La Stampa a @GiuseppeConteIT, Presidente del MoVimento 5 Stelle.

Qui il testo integrale…",380,"[{'screen_name': 'Mov5Stelle', 'name': 'MoVimento 5 Stelle', 'id': 289400495, 'id_str': '289400495', 'indices': [3, 14]}, {'screen_name': 'GiuseppeConteIT', 'name': 'Giuseppe Conte', 'id': 999578121123848192, 'id_str': '999578121123848192', 'indices': [63, 79]}]",,GiuseppeConte,[],"['Mov5Stelle', 'GiuseppeConteIT']","rt  leggi l’intervista realizzata da la stampa a  presidente del movimento 5 stelle 
qui il testo integrale…","['rt', 'leggere', 'intervista', 'realizzare', 'stampa', 'presidente', 'movimento', 'stella', 'qui', 'testo', 'integrale']",rt leggere intervista realizzare stampa presidente movimento stella qui testo integrale,joy,"{'neg': 0.125, 'neu': 0.375, 'pos': 0.5, 'compound': 0.6124}",0.125,0.375,0.5,0.6124,positivo
Sun Jul 24 09:51:13 +0000 2022,1551142953896361984,"RT @Mov5Stelle: Ci sono lavoratori che prendono 3 o 4 euro lordi l'ora, 50mila aziende sull'orlo del fallimento per i crediti bloccati del…",393,"[{'screen_name': 'Mov5Stelle', 'name': 'MoVimento 5 Stelle', 'id': 289400495, 'id_str': '289400495', 'indices': [3, 14]}]",,GiuseppeConte,[],['Mov5Stelle'],rt  ci sono lavoratori che prendono 3 o 4 euro lordi l ora 50mila aziende sull orlo del fallimento per i crediti bloccati del…,"['rt', 'essere', 'lavoratore', 'prendere', 'euro', 'lordo', 'ora', 'azienda', 'orlo', 'fallimento', 'credito', 'bloccare']",rt essere lavoratore prendere euro lordo ora azienda orlo fallimento credito bloccare,anger,"{'neg': 0.5, 'neu': 0.2, 'pos': 0.3, 'compound': -0.4588}",0.5,0.2,0.3,-0.4588,negativo
Sat Jul 23 21:55:19 +0000 2022,1550962791632306181,Grazie @FloridiaBarbara! https://t.co/7TFcMswaiv,384,"[{'screen_name': 'FloridiaBarbara', 'name': 'Barbara Floridia', 'id': 993396057727012869, 'id_str': '993396057727012869', 'indices': [7, 23]}]",,GiuseppeConte,[],['FloridiaBarbara'],grazie! ,['grazia!'],grazia!,joy,"{'neg': 0.0, 'neu': 0.0, 'pos': 1.0, 'compound': 0.3164}",0.0,0.0,1.0,0.3164,positivo
Sat Jul 23 11:24:05 +0000 2022,1550803935874646018,https://t.co/YVljPgFh7i https://t.co/YTM4UObEAX,1015,[],,GiuseppeConte,[],[],,[],,fear,"{'neg': 0.0, 'neu': 1.0, 'pos': 0.0, 'compound': 0.0}",0.0,1.0,0.0,0.0,neutrale
Thu Jul 21 14:50:52 +0000 2022,1550131198550192137,Questa sera a #ZonaBianca https://t.co/91bFnA0VIi,323,[],,GiuseppeConte,['ZonaBianca'],[],questa sera a ,['sera'],sera,joy,"{'neg': 0.0, 'neu': 1.0, 'pos': 0.0, 'compound': 0.0}",0.0,1.0,0.0,0.0,neutrale
Tue Jul 19 13:25:44 +0000 2022,1549384997425094656,"Le parole di #PaoloBorsellino hanno il peso dell’esempio di chi è stato ucciso per difendere valori inossidabili di legalità e giustizia, per proteggere il presente, il futuro e la dignità di tutti noi. Il suo sacrificio ci impone di andare ogni giorno oltre la semplice memoria. https://t.co/KQg7Xh6z3V",554,[],,GiuseppeConte,['PaoloBorsellino'],[],le parole di hanno il peso dell’esempio di chi è stato ucciso per difendere valori inossidabili di legalità e giustizia per proteggere il presente il futuro e la dignità di tutti noi il suo sacrificio ci impone di andare ogni giorno oltre la semplice memoria ,"['parola', 'avere', 'peso', 'esempio', 'essere', 'essere|stare', 'uccidere', 'difendere', 'valore', 'inossidabile', 'legalità', 'giustizia', 'proteggere', 'presente', 'futuro', 'dignità', 'sacrificio', 'imporre', 'andare', 'ogni', 'giorno', 'oltre', 'semplice', 'memoria']",parola avere peso esempio essere essere|stare uccidere difendere valore inossidabile legalità giustizia proteggere presente futuro dignità sacrificio imporre andare ogni giorno oltre semplice memoria,sadness,"{'neg': 0.303, 'neu': 0.177, 'pos': 0.52, 'compound': 0.6817}",0.303,0.177,0.52,0.6817,positivo
Sat Jul 16 17:56:47 +0000 2022,1548366047127822338,In diretta dalla sede del @Mov5Stelle: https://t.co/iHDCdC3CTf,389,"[{'screen_name': 'Mov5Stelle', 'name': 'MoVimento 5 Stelle', 'id': 289400495, 'id_str': '289400495', 'indices': [26, 37]}]",,GiuseppeConte,[],['Mov5Stelle'],in diretta dalla sede del  ,"['diretto', 'sede']",diretto sede,joy,"{'neg': 0.667, 'neu': 0.333, 'pos': 0.0, 'compound': -0.25}",0.667,0.333,0.0,-0.25,negativo
Thu Jul 14 11:47:43 +0000 2022,1547548392456392705,"Con Eugenio Scalfari l’Italia perde una voce autorevole che ha raccontato il Paese con passione e dedizione, contribuendo a coltivare in ogni lettore una coscienza critica, senza mai cedere al sensazionalismo. Le mie condoglianze ai suoi cari e alla redazione di @repubblica",175,"[{'screen_name': 'repubblica', 'name': 'Repubblica', 'id': 18935802, 'id_str': '18935802', 'indices': [263, 274]}]",,GiuseppeConte,[],['repubblica'],con eugenio scalfari l’italia perde una voce autorevole che ha raccontato il paese con passione e dedizione contribuendo a coltivare in ogni lettore una coscienza critica senza mai cedere al sensazionalismo le mie condoglianze ai suoi cari e alla redazione di ,"['eugenio', 'scalfari', 'italia', 'perdere', 'voce', 'autorevole', 'avere', 'raccontare', 'paese', 'passione', 'dedizione', 'contribuire', 'coltivare', 'ogni', 'lettore', 'coscienza', 'critico', 'senza', 'mai', 'cedere', 'sensazionalismo', 'condoglianza', 'caro', 'redazione']",eugenio scalfari italia perdere voce autorevole avere raccontare paese passione dedizione contribuire coltivare ogni lettore coscienza critico senza mai cedere sensazionalismo condoglianza caro redazione,sadness,"{'neg': 0.26, 'neu': 0.304, 'pos': 0.436, 'compound': 0.653}",0.26,0.304,0.436,0.653,positivo
Wed Jul 13 19:56:05 +0000 2022,1547308905453297667,In diretta dalla Camera dei deputati il mio intervento all’assemblea dei gruppi parlamentari del @Mov5Stelle: https://t.co/3iQlp2Qm1P,407,"[{'screen_name': 'Mov5Stelle', 'name': 'MoVimento 5 Stelle', 'id': 289400495, 'id_str': '289400495', 'indices': [97, 108]}]",,GiuseppeConte,[],['Mov5Stelle'],in diretta dalla camera dei deputati il mio intervento all’assemblea dei gruppi parlamentari del  ,"['diretto', 'camera', 'deputato', 'intervento', 'assemblea', 'gruppo', 'parlamentare']",diretto camera deputato intervento assemblea gruppo parlamentare,joy,"{'neg': 0.667, 'neu': 0.167, 'pos': 0.167, 'compound': -0.6124}",0.667,0.167,0.167,-0.6124,negativo
Sun Jul 10 17:29:03 +0000 2022,1546184738381205506,Leggo adesso che la Procura di Perugia avrebbe accertato la falsità di queste accuse. Riporto io questa notizia perché dubito che la troverete rilanciata da quegli stessi organi di stampa che l’hanno a suo tempo cavalcata.,635,[],,GiuseppeConte,[],[],leggo adesso che la procura di perugia avrebbe accertato la falsità di queste accuse riporto io questa notizia perché dubito che la troverete rilanciata da quegli stessi organi di stampa che l’hanno a suo tempo cavalcata ,"['leggere', 'adesso', 'procura', 'perugia', 'avere', 'accertare', 'falsità', 'accusa', 'riporto', 'notizia', 'dubitare', 'trovare', 'rilanciare', 'stesso', 'organo', 'stampa', 'tempo', 'cavalcare']",leggere adesso procura perugia avere accertare falsità accusa riporto notizia dubitare trovare rilanciare stesso organo stampa tempo cavalcare,anger,"{'neg': 0.214, 'neu': 0.249, 'pos': 0.537, 'compound': 0.7268}",0.214,0.249,0.537,0.7268,positivo
Sun Jul 10 17:29:02 +0000 2022,1546184734945976323,Molti di voi avranno seguito trasmissioni tv e letto articoli di giornale che rilanciavano le accuse completamente false di Amara sul mio conto. Accuse gravi perché messe a verbale davanti alla Procura quando ero PdC e chiaramente rivolte a indebolirmi nell’azione di governo. https://t.co/BrNhTRRrw6,826,[],,GiuseppeConte,[],[],molti di voi avranno seguito trasmissioni tv e letto articoli di giornale che rilanciavano le accuse completamente false di amara sul mio conto accuse gravi perché messe a verbale davanti alla procura quando ero pdc e chiaramente rivolte a indebolirmi nell’azione di governo ,"['molto', 'avere', 'seguire', 'trasmissione', 'tv', 'letto', 'articolo', 'giornale', 'rilanciare', 'accusa', 'completamente', 'falso', 'amaro', 'conto', 'accusa', 'grave', 'messo', 'verbale', 'davanti', 'procura', 'quando', 'essere', 'pdc', 'chiaramente', 'rivolgere', 'indebolire', 'azione', 'governo']",molto avere seguire trasmissione tv letto articolo giornale rilanciare accusa completamente falso amaro conto accusa grave messo verbale davanti procura quando essere pdc chiaramente rivolgere indebolire azione governo,anger,"{'neg': 0.364, 'neu': 0.306, 'pos': 0.33, 'compound': -0.1121}",0.364,0.306,0.33,-0.1121,negativo
Fri Jul 08 15:42:33 +0000 2022,1545433164994445312,Oggi la nostra comunità è chiamata a esprimersi e scegliere. Sono infatti aperte le votazioni per l’elezione dei rappresentanti nel Consiglio nazionale. Partecipate ⤵️ https://t.co/AQ7EYX3nCn,144,[],,GiuseppeConte,[],[],oggi la nostra comunità è chiamata a esprimersi e scegliere sono infatti aperte le votazioni per l’elezione dei rappresentanti nel consiglio nazionale partecipate ,"['oggi', 'comunità', 'essere', 'chiamare', 'esprimere', 'scegliere', 'essere', 'infatti', 'aprire', 'votazione', 'elezione', 'rappresentante', 'consiglio', 'nazionale', 'partecipare']",oggi comunità essere chiamare esprimere scegliere essere infatti aprire votazione elezione rappresentante consiglio nazionale partecipare,joy,"{'neg': 0.0, 'neu': 0.429, 'pos': 0.571, 'compound': 0.8402}",0.0,0.429,0.571,0.8402,positivo
Fri Jul 08 13:56:08 +0000 2022,1545406382895144961,"Chiediamo che le urgenze dei cittadini siano anche le urgenze del governo. Né più, né meno. E su questo il @Mov5Stelle e il Paese aspettano le risposte di Palazzo Chigi. https://t.co/OmzRSCrUFQ",432,"[{'screen_name': 'Mov5Stelle', 'name': 'MoVimento 5 Stelle', 'id': 289400495, 'id_str': '289400495', 'indices': [107, 118]}]",,GiuseppeConte,[],['Mov5Stelle'],chiediamo che le urgenze dei cittadini siano anche le urgenze del governo né più né meno e su questo il e il paese aspettano le risposte di palazzo chigi ,"['chiedere', 'urgenza', 'cittadino', 'essere', 'urgenza', 'governo', 'né', 'né', 'meno', 'paese', 'aspettare', 'risposta', 'palazzo', 'chigi']",chiedere urgenza cittadino essere urgenza governo né né meno paese aspettare risposta palazzo chigi,sadness,"{'neg': 0.333, 'neu': 0.556, 'pos': 0.111, 'compound': -0.4588}",0.333,0.556,0.111,-0.4588,negativo
Fri Jul 08 11:01:19 +0000 2022,1545362389645856769,"Servono segnali immediati. Nessuno si salverà da crisi e inflazione con un bonus una tantum da 200 euro. Il @Mov5Stelle è nato per difendere i diritti dei cittadini e rispondere ai loro bisogni reali. Ad ogni costo, in ogni momento. https://t.co/nsOq4IYEWp",529,"[{'screen_name': 'Mov5Stelle', 'name': 'MoVimento 5 Stelle', 'id': 289400495, 'id_str': '289400495', 'indices': [108, 119]}]",,GiuseppeConte,[],['Mov5Stelle'],servono segnali immediati nessuno si salverà da crisi e inflazione con un bonus una tantum da 200 euro il è nato per difendere i diritti dei cittadini e rispondere ai loro bisogni reali ad ogni costo in ogni momento ,"['servire', 'segnale', 'immediato', 'nessuno', 'salvare', 'crisi', 'inflazione', 'bonus', 'tantum', 'euro', 'essere', 'nascere', 'difendere', 'diritto', 'cittadino', 'rispondere', 'bisogno', 'reale', 'ogni', 'costo', 'ogni', 'momento']",servire segnale immediato nessuno salvare crisi inflazione bonus tantum euro essere nascere difendere diritto cittadino rispondere bisogno reale ogni costo ogni momento,anger,"{'neg': 0.239, 'neu': 0.358, 'pos': 0.403, 'compound': 0.6705}",0.239,0.358,0.403,0.6705,positivo
Fri Jul 08 07:50:09 +0000 2022,1545314279729004544,"Accolgo con sgomento la notizia dell’attentato a Shinzo Abe, esempio di intenso e devoto impegno a servizio delle Istituzioni del proprio Paese. La mia vicinanza ai suoi cari e al popolo giapponese. https://t.co/HAoY1xfAn6",191,[],,GiuseppeConte,[],[],accolgo con sgomento la notizia dell’attentato a shinzo abe esempio di intenso e devoto impegno a servizio delle istituzioni del proprio paese la mia vicinanza ai suoi cari e al popolo giapponese ,"['accogliere', 'sgomento', 'notizia', 'attentare', 'shinzo', 'abe', 'esempio', 'intenso', 'devoto', 'impegno', 'servizio', 'istituzione', 'proprio', 'paese', 'vicinanza', 'caro', 'popolo', 'giapponese']",accogliere sgomento notizia attentare shinzo abe esempio intenso devoto impegno servizio istituzione proprio paese vicinanza caro popolo giapponese,sadness,"{'neg': 0.115, 'neu': 0.346, 'pos': 0.538, 'compound': 0.8402}",0.115,0.346,0.538,0.8402,positivo
Wed Jul 06 18:43:56 +0000 2022,1544754035571539973,Il mio intervento all’assemblea dei gruppi parlamentari del @Mov5Stelle: https://t.co/ChMKW1oKHp,228,"[{'screen_name': 'Mov5Stelle', 'name': 'MoVimento 5 Stelle', 'id': 289400495, 'id_str': '289400495', 'indices': [60, 71]}]",,GiuseppeConte,[],['Mov5Stelle'],il mio intervento all’assemblea dei gruppi parlamentari del  ,"['intervento', 'assemblea', 'gruppo', 'parlamentare']",intervento assemblea gruppo parlamentare,joy,"{'neg': 0.571, 'neu': 0.143, 'pos': 0.286, 'compound': -0.25}",0.571,0.143,0.286,-0.25,negativo
Wed Jul 06 13:41:17 +0000 2022,1544677870290845697,"RT @Mov5Stelle: Ecco il documento che @GiuseppeConteIT ha consegnato a Mario Draghi ⤵️

https://t.co/VNo7iMIjCM",253,"[{'screen_name': 'Mov5Stelle', 'name': 'MoVimento 5 Stelle', 'id': 289400495, 'id_str': '289400495', 'indices': [3, 14]}, {'screen_name': 'GiuseppeConteIT', 'name': 'Giuseppe Conte', 'id': 999578121123848192, 'id_str': '999578121123848192', 'indices': [38, 54]}]",,GiuseppeConte,[],"['Mov5Stelle', 'GiuseppeConteIT']","rt  ecco il documento che ha consegnato a mario draghi 
","['rt', 'ecco', 'documento', 'avere', 'consegnare', 'mario', 'drago']",rt ecco documento avere consegnare mario drago,joy,"{'neg': 0.25, 'neu': 0.75, 'pos': 0.0, 'compound': -0.25}",0.25,0.75,0.0,-0.25,negativo
Mon Jul 04 18:17:30 +0000 2022,1544022605371432962,"RT @Mov5Stelle: Sono convocate per venerdì 8 e martedì 12 luglio 2022 le assemblee speciali degli iscritti 

Leggi qui 👇
https://t.co/Mlxx3…",132,"[{'screen_name': 'Mov5Stelle', 'name': 'MoVimento 5 Stelle', 'id': 289400495, 'id_str': '289400495', 'indices': [3, 14]}]",,GiuseppeConte,[],['Mov5Stelle'],"rt  sono convocate per venerdì 8 e martedì 12 luglio 2022 le assemblee speciali degli iscritti 
leggi qui ","['rt', 'essere', 'convocare', 'venerdì', 'martedì', 'luglio', 'assemblea', 'speciale', 'iscrivere', 'legge', 'qui']",rt essere convocare venerdì martedì luglio assemblea speciale iscrivere legge qui,joy,"{'neg': 0.269, 'neu': 0.584, 'pos': 0.146, 'compound': -0.1749}",0.269,0.584,0.146,-0.1749,negativo
Mon Jul 04 12:56:59 +0000 2022,1543941944040198146,"La famiglia di Willy ha ottenuto giustizia. Questa sentenza non li ripagherà del dolore che soffrono. Sta a noi ora seminare l’esempio di Willy fra i nostri ragazzi: generosità, solidarietà e contrasto a ogni forma di odio e indifferenza. Emarginiamo la violenza dalle nostre vite https://t.co/j6b929ca2h",299,[],,GiuseppeConte,[],[],la famiglia di willy ha ottenuto giustizia questa sentenza non li ripagherà del dolore che soffrono sta a noi ora seminare l’esempio di willy fra i nostri ragazzi generosità solidarietà e contrasto a ogni forma di odio e indifferenza emarginiamo la violenza dalle nostre vite ,"['famiglia', 'willy', 'avere', 'ottenere', 'giustizia', 'sentenza', 'ripagare', 'dolore', 'soffrire', 'stare', 'ora', 'seminare', 'esempio', 'willy', 'fra', 'ragazzo', 'generosità', 'solidarietà', 'contrasto', 'ogni', 'forma', 'odio', 'indifferenza', 'emarginare', 'violenza', 'vita|vite']",famiglia willy avere ottenere giustizia sentenza ripagare dolore soffrire stare ora seminare esempio willy fra ragazzo generosità solidarietà contrasto ogni forma odio indifferenza emarginare violenza vita|vite,sadness,"{'neg': 0.479, 'neu': 0.248, 'pos': 0.273, 'compound': -0.7414}",0.479,0.248,0.273,-0.7414,negativo
