created,id,testo,rt,rt_names,location,cluster,hashtag,mention,text_clean,tokenized_text,sentiment_text,emotion,sentiment,neg,neu,pos,compound,new_sent
Tue Sep 06 21:27:08 +0000 2022,1567263153200791552,"RT @RaiPortaaPorta: Ospite stasera, #6settembre, a #PortaaPorta Giorgia Meloni sul programma di FdI per le elezioni 2022👇 https://t.co/r5WE…",52,"[{'screen_name': 'RaiPortaaPorta', 'name': 'Porta a Porta', 'id': 406880559, 'id_str': '406880559', 'indices': [3, 18]}]",Italia,GiorgiaMeloni,"['6settembre', 'PortaaPorta']",['RaiPortaaPorta'],rt  ospite stasera  a giorgia meloni sul programma di fdi per le elezioni 2022 ,"['rt', 'ospite', 'stasera', 'giorgia', 'melone', 'programma', 'fdi', 'elezione']",rt ospite stasera giorgia melone programma fdi elezione,joy,"{'neg': 0.222, 'neu': 0.778, 'pos': 0.0, 'compound': -0.25}",0.222,0.778,0.0,-0.25,negativo
Tue Sep 06 20:27:29 +0000 2022,1567248141367271425,"Rispondere sempre con il sorriso! 
(Almeno finché dura 😉) https://t.co/LEQr27dh50",220,[],Italia,GiorgiaMeloni,[],[],rispondere sempre con il sorriso!  almeno finché dura  ,"['rispondere', 'sempre', 'sorriso!', 'almeno', 'finché', 'duro']",rispondere sempre sorriso! almeno finché duro,joy,"{'neg': 0.611, 'neu': 0.194, 'pos': 0.194, 'compound': -0.5093}",0.611,0.194,0.194,-0.5093,negativo
Tue Sep 06 16:19:54 +0000 2022,1567185833127546883,"Con queste bellissime e commoventi parole, la famiglia ha voluto ricordare Willy, giovane che ha pagato con la vita il suo coraggio: https://t.co/1I8pdZZ7h5

Il tempo trascorso non ha sbiadito il ricordo. Il suo sorriso è vivo in tutte le persone che lo hanno amato e voluto bene. https://t.co/CL0n5qFQ0N",56,[],Italia,GiorgiaMeloni,[],[],"con queste bellissime e commoventi parole la famiglia ha voluto ricordare willy giovane che ha pagato con la vita il suo coraggio 

il tempo trascorso non ha sbiadito il ricordo il suo sorriso è vivo in tutte le persone che lo hanno amato e voluto bene ","['bello', 'commovente', 'parola', 'famiglia', 'avere', 'volere', 'ricordare', 'willy', 'giovane', 'avere', 'pagare', 'vita', 'coraggio', 'tempo', 'trascorso', 'avere', 'sbiadire', 'ricordo', 'sorriso', 'essere', 'vivo', 'persona', 'avere', 'amare', 'volere', 'bene']",bello commovente parola famiglia avere volere ricordare willy giovane avere pagare vita coraggio tempo trascorso avere sbiadire ricordo sorriso essere vivo persona avere amare volere bene,joy,"{'neg': 0.293, 'neu': 0.34, 'pos': 0.366, 'compound': 0.4216}",0.293,0.34,0.366,0.4216,positivo
Tue Sep 06 13:43:46 +0000 2022,1567146541122555904,Questa sera appuntamento a #PortaAPorta su Rai1 https://t.co/tr8oZzdgOv,137,[],Italia,GiorgiaMeloni,['PortaAPorta'],[],questa sera appuntamento a su rai1 ,"['sera', 'appuntamento', 'rai1']",sera appuntamento rai1,joy,"{'neg': 0.413, 'neu': 0.587, 'pos': 0.0, 'compound': -0.1052}",0.413,0.587,0.0,-0.1052,negativo
Tue Sep 06 10:36:44 +0000 2022,1567099474249502720,"Enrico Letta definisce il #Rosatellum “la peggiore legge elettorale che ha visto il nostro Paese”. E ha ragione. Non a caso è stata scritta e imposta dal PD, con il voto contrario di @FratellidItalia. Ma quanto fa ridere la sinistra italiana? https://t.co/RJdJLxzUSv",363,"[{'screen_name': 'FratellidItalia', 'name': ""Fratelli d'Italia 🇮🇹"", 'id': 1024976264, 'id_str': '1024976264', 'indices': [183, 199]}]",Italia,GiorgiaMeloni,['Rosatellum'],['FratellidItalia'],enrico letta definisce il “la peggiore legge elettorale che ha visto il nostro paese” e ha ragione non a caso è stata scritta e imposta dal pd con il voto contrario di  ma quanto fa ridere la sinistra italiana ,"['enrico', 'letta', 'definire', '“', 'cattivo', 'legge', 'elettorale', 'avere', 'vedere', 'paese', '”', 'avere', 'ragione', 'caso', 'essere', 'essere|stare', 'scrivere', 'imposta', 'pd', 'voto', 'contrario', 'fare', 'ridere', 'sinistra', 'italiano']",enrico letta definire “ cattivo legge elettorale avere vedere paese ” avere ragione caso essere essere|stare scrivere imposta pd voto contrario fare ridere sinistra italiano,anger,"{'neg': 0.412, 'neu': 0.353, 'pos': 0.235, 'compound': -0.6124}",0.412,0.353,0.235,-0.6124,negativo
Tue Sep 06 09:06:54 +0000 2022,1567076864509837312,"Grazie a tutti coloro che giorno dopo giorno scelgono di avere fiducia nelle idee di @FratellidItalia per risollevare la Nazione, nonostante i continui attacchi e le mistificazioni dei nostri avversari. Ma la corsa non è finita: c’è ancora tanto lavoro da fare. #VotaFDI #Meloni https://t.co/zRwgrhjFFS",159,"[{'screen_name': 'FratellidItalia', 'name': ""Fratelli d'Italia 🇮🇹"", 'id': 1024976264, 'id_str': '1024976264', 'indices': [85, 101]}]",Italia,GiorgiaMeloni,"['VotaFDI', 'Meloni']",['FratellidItalia'],grazie a tutti coloro che giorno dopo giorno scelgono di avere fiducia nelle idee di per risollevare la nazione nonostante i continui attacchi e le mistificazioni dei nostri avversari ma la corsa non è finita c’è ancora tanto lavoro da fare ,"['grazie', 'colorare', 'giorno', 'dopo', 'giorno', 'scegliere', 'avere', 'fiducia', 'idea', 'risollevare', 'nazione', 'nonostante', 'continuo', 'attacco', 'mistificazione', 'avversario', 'corsa', 'essere', 'finire', 'ancora', 'tanto', 'lavoro', 'fare']",grazie colorare giorno dopo giorno scegliere avere fiducia idea risollevare nazione nonostante continuo attacco mistificazione avversario corsa essere finire ancora tanto lavoro fare,joy,"{'neg': 0.3, 'neu': 0.181, 'pos': 0.518, 'compound': 0.7513}",0.3,0.181,0.518,0.7513,positivo
Mon Sep 05 19:30:50 +0000 2022,1566871495892156423,"Anche oggi su tele La7, a #ottoemezzo dalla Gruber, Carlo De Benedetti riversa tutto il suo astio contro di me e @FratellidItalia. Benissimo! Vuol dire che stiamo facendo un ottimo lavoro. Avanti così!",346,"[{'screen_name': 'FratellidItalia', 'name': ""Fratelli d'Italia 🇮🇹"", 'id': 1024976264, 'id_str': '1024976264', 'indices': [113, 129]}]",Italia,GiorgiaMeloni,['ottoemezzo'],['FratellidItalia'],anche oggi su tele la7 a dalla gruber carlo de benedetti riversa tutto il suo astio contro di me e  benissimo! vuol dire che stiamo facendo un ottimo lavoro avanti così!,"['oggi', 'tela|tele', 'la7', 'gruber', 'carlo', 'de', 'benedetto', 'riversare', 'astio', 'me', 'benissimo!', 'volere', 'dire', 'stare', 'fare', 'ottimo', 'lavoro', 'avanti', 'così!']",oggi tela|tele la7 gruber carlo de benedetto riversare astio me benissimo! volere dire stare fare ottimo lavoro avanti così!,anger,"{'neg': 0.068, 'neu': 0.307, 'pos': 0.625, 'compound': 0.9068}",0.068,0.307,0.625,0.9068,positivo
Mon Sep 05 14:20:49 +0000 2022,1566793479992348674,"RT @FratellidItalia: LETTERA DI GIORGIA #MELONI AL CORRIERE DELLA SERA
👉 https://t.co/8kzYHFemob https://t.co/uVi5UuefKC",148,"[{'screen_name': 'FratellidItalia', 'name': ""Fratelli d'Italia 🇮🇹"", 'id': 1024976264, 'id_str': '1024976264', 'indices': [3, 19]}]",Italia,GiorgiaMeloni,['MELONI'],['FratellidItalia'],"rt  lettera di giorgia al corriere della sera
 ","['rt', 'lettera', 'giorgia', 'corriere', 'sera']",rt lettera giorgia corriere sera,joy,"{'neg': 0.0, 'neu': 0.667, 'pos': 0.333, 'compound': 0.25}",0.0,0.667,0.333,0.25,positivo
Mon Sep 05 14:06:28 +0000 2022,1566789868302262276,"RT @ECRparty: A statement from @ECRparty and Brothers of Italy President @GiorgiaMeloni:""Congratulations to Liz Truss, new leader of the Br…",37,"[{'screen_name': 'ECRparty', 'name': 'ECR Party', 'id': 1498076587, 'id_str': '1498076587', 'indices': [3, 12]}, {'screen_name': 'ECRparty', 'name': 'ECR Party', 'id': 1498076587, 'id_str': '1498076587', 'indices': [31, 40]}, {'screen_name': 'GiorgiaMeloni', 'name': 'Giorgia Meloni 🇮🇹 ن', 'id': 130537001, 'id_str': '130537001', 'indices': [73, 87]}]",Italia,GiorgiaMeloni,[],"['ECRparty', 'ECRparty', 'GiorgiaMeloni']",rt  a statement from and brothers of italy president  congratulations to liz truss new leader of the br…,"['rt', 'statement', 'from', 'and', 'brothers', 'of', 'italy', 'president', 'congratulations', 'to', 'liz', 'truss', 'new', 'leader', 'of', 'the', 'br']",rt statement from and brothers of italy president congratulations to liz truss new leader of the br,joy,"{'neg': 0.0, 'neu': 0.804, 'pos': 0.196, 'compound': 0.5994}",0.0,0.804,0.196,0.5994,positivo
Mon Sep 05 14:06:27 +0000 2022,1566789863944470529,"RT @ECRparty: The Tories are among the founders of the European Conservative family, which I am honored to chair. I am certain that, togeth…",23,"[{'screen_name': 'ECRparty', 'name': 'ECR Party', 'id': 1498076587, 'id_str': '1498076587', 'indices': [3, 12]}]",Italia,GiorgiaMeloni,[],['ECRparty'],rt  the tories are among the founders of the european conservative family which i am honored to chair i am certain that togeth…,"['rt', 'the', 'tory', 'ara', 'among', 'the', 'founders', 'of', 'the', 'european', 'conservativo', 'family', 'which', 'am', 'honored', 'to', 'chair', 'am', 'certain', 'that', 'togeth']",rt the tory ara among the founders of the european conservativo family which am honored to chair am certain that togeth,joy,"{'neg': 0.0, 'neu': 0.763, 'pos': 0.237, 'compound': 0.7096}",0.0,0.763,0.237,0.7096,positivo
Mon Sep 05 10:21:01 +0000 2022,1566733131012530178,"Grazie Vittorio. Con il Centrodestra unito e un Governo forte e solido, siamo #Pronti a risollevare l'Italia. https://t.co/pWFJw3KyLE",272,[],Italia,GiorgiaMeloni,['Pronti'],[],grazie vittorio con il centrodestra unito e un governo forte e solido siamo a risollevare l italia ,"['grazie', 'vittorio', 'centrodestra', 'unito', 'governo', 'forte', 'solido', 'essere', 'risollevare', 'italia']",grazie vittorio centrodestra unito governo forte solido essere risollevare italia,joy,"{'neg': 0.143, 'neu': 0.429, 'pos': 0.429, 'compound': 0.4588}",0.143,0.429,0.429,0.4588,positivo
Sun Sep 04 11:38:37 +0000 2022,1566390269448265734,"RT @Ambrosetti_: Secondo @GiorgiaMeloni a #Cernobbio2022: ""dobbiamo pensare alle nostre catene del valore. Io credo che questa sia una sfid…",38,"[{'screen_name': 'Ambrosetti_', 'name': 'The European House - Ambrosetti', 'id': 381532613, 'id_str': '381532613', 'indices': [3, 15]}, {'screen_name': 'GiorgiaMeloni', 'name': 'Giorgia Meloni 🇮🇹 ن', 'id': 130537001, 'id_str': '130537001', 'indices': [25, 39]}]",Italia,GiorgiaMeloni,['Cernobbio2022'],"['Ambrosetti_', 'GiorgiaMeloni']",rt  secondo a  dobbiamo pensare alle nostre catene del valore io credo che questa sia una sfid…,"['rt', 'secondo', 'dovere', 'pensare', 'catena', 'valore', 'credere', 'sfid']",rt secondo dovere pensare catena valore credere sfid,joy,"{'neg': 0.351, 'neu': 0.351, 'pos': 0.297, 'compound': -0.1581}",0.351,0.351,0.297,-0.1581,negativo
Sun Sep 04 08:17:00 +0000 2022,1566339533880295429,"Hanno paura della nostra vittoria e le stanno tentando tutte per fermarci. Ma le nostre spalle sono larghe, perché ci siete voi a sostenerci. 
Il 25 settembre dimostriamo insieme che non esiste potere più forte di quello del popolo italiano. https://t.co/eLJHC5BLf1",308,[],Italia,GiorgiaMeloni,[],[],"hanno paura della nostra vittoria e le stanno tentando tutte per fermarci ma le nostre spalle sono larghe perché ci siete voi a sostenerci 
il 25 settembre dimostriamo insieme che non esiste potere più forte di quello del popolo italiano ","['avere', 'paura', 'vittoria', 'stare', 'tentare', 'fermare', 'spalla', 'essere', 'largo', 'essere', 'sostenere', 'settembre', 'dimostrare', 'insieme', 'esistere', 'potere', 'forte', 'popolo', 'italiano']",avere paura vittoria stare tentare fermare spalla essere largo essere sostenere settembre dimostrare insieme esistere potere forte popolo italiano,fear,"{'neg': 0.378, 'neu': 0.192, 'pos': 0.43, 'compound': 0.1581}",0.378,0.192,0.43,0.1581,positivo
Sat Sep 03 11:25:12 +0000 2022,1566024506627465216,"«Il mio unico pensiero, la mia speranza, era quello di arrivare in tempo dalla ragazza e salvarla».
Così Alberto, agente della Polizia di  Stato, ha salvato appena in tempo una giovane donna che ha tentato di lanciarsi nel vuoto da un’impalcatura.
Onore a te, eroe 👏 https://t.co/r21u6pPCqE",96,[],Italia,GiorgiaMeloni,[],[],«il mio unico pensiero la mia speranza era quello di arrivare in tempo dalla ragazza e salvarla» così alberto agente della polizia di stato ha salvato appena in tempo una giovane donna che ha tentato di lanciarsi nel vuoto da un’impalcatura onore a te eroe ,"['«', 'unico', 'pensiero', 'speranza', 'essere', 'arrivare', 'tempo', 'ragazza', 'salvare', '»', 'così', 'alberto', 'agente', 'polizia', 'stato', 'avere', 'salvare', 'appena', 'tempo', 'giovane', 'donna', 'avere', 'tentare', 'lanciare', 'vuoto', 'impalcatura', 'onore', 'te', 'eroe']",« unico pensiero speranza essere arrivare tempo ragazza salvare » così alberto agente polizia stato avere salvare appena tempo giovane donna avere tentare lanciare vuoto impalcatura onore te eroe,joy,"{'neg': 0.297, 'neu': 0.129, 'pos': 0.574, 'compound': 0.8359}",0.297,0.129,0.574,0.8359,positivo
Sat Sep 03 07:16:21 +0000 2022,1565961883567460353,"40 anni fa, moriva nella strage di via Carini il Generale dei carabinieri Carlo Alberto dalla Chiesa: Eroe italiano caduto per cercare di liberare l'Italia dalla criminalità organizzata. Grazie di tutto generale, il tuo ricordo continua a vivere in noi. https://t.co/LzKz5W59Fr",210,[],Italia,GiorgiaMeloni,[],[],40 anni fa moriva nella strage di via carini il generale dei carabinieri carlo alberto dalla chiesa eroe italiano caduto per cercare di liberare l italia dalla criminalità organizzata grazie di tutto generale il tuo ricordo continua a vivere in noi ,"['anno', 'fa', 'morire', 'strage', 'via', 'carino', 'generale', 'carabiniere', 'carlo', 'alberto', 'chiesa', 'eroe', 'italiano', 'cadere', 'cercare', 'liberare', 'italia', 'criminalità', 'organizzare', 'grazie', 'generale', 'ricordo', 'continuare', 'vivere']",anno fa morire strage via carino generale carabiniere carlo alberto chiesa eroe italiano cadere cercare liberare italia criminalità organizzare grazie generale ricordo continuare vivere,sadness,"{'neg': 0.173, 'neu': 0.375, 'pos': 0.452, 'compound': 0.7709}",0.173,0.375,0.452,0.7709,positivo
Fri Sep 02 19:11:12 +0000 2022,1565779392558780417,"Il confronto è sempre un bel momento, anche quando un contestatore scavalca le transenne per salire sul palco. 
Rispetto sempre il coraggio delle persone di difendere ciò in cui credono, e allo stesso tempo rivendico il mio diritto a pensarla diversamente. https://t.co/r8KNdzPinR",553,[],Italia,GiorgiaMeloni,[],[],"il confronto è sempre un bel momento anche quando un contestatore scavalca le transenne per salire sul palco 
rispetto sempre il coraggio delle persone di difendere ciò in cui credono e allo stesso tempo rivendico il mio diritto a pensarla diversamente ","['confronto', 'essere', 'sempre', 'bel', 'momento', 'quando', 'contestatore', 'scavalcare', 'transenna', 'salire', 'palco', 'rispettare', 'sempre', 'coraggio', 'persona', 'difendere', 'ciò', 'credere', 'stesso', 'tempo', 'rivendicare', 'diritto', 'pensare', 'diversamente']",confronto essere sempre bel momento quando contestatore scavalcare transenna salire palco rispettare sempre coraggio persona difendere ciò credere stesso tempo rivendicare diritto pensare diversamente,joy,"{'neg': 0.222, 'neu': 0.342, 'pos': 0.436, 'compound': 0.6693}",0.222,0.342,0.436,0.6693,positivo
Fri Sep 02 18:08:40 +0000 2022,1565763654775181314,Grazie Cagliari! https://t.co/8qS3J3xpnW,254,[],Italia,GiorgiaMeloni,[],[],grazie cagliari! ,"['grazia', 'cagliari!']",grazia cagliari!,joy,"{'neg': 0.0, 'neu': 0.304, 'pos': 0.696, 'compound': 0.3164}",0.0,0.304,0.696,0.3164,positivo
Thu Sep 01 18:17:43 +0000 2022,1565403545041518595,Grazie Perugia! https://t.co/ZZT1KaB7jd,268,[],Italia,GiorgiaMeloni,[],[],grazie perugia! ,"['grazie', 'perugia!']",grazie perugia!,joy,"{'neg': 0.0, 'neu': 0.304, 'pos': 0.696, 'compound': 0.3164}",0.0,0.304,0.696,0.3164,positivo
Thu Sep 01 17:18:24 +0000 2022,1565388616750309376,"Che accoglienza a Perugia!
Seguite la diretta qui ⤵️
https://t.co/YH7zVsDGbU https://t.co/D2nQUZyQy4",173,[],Italia,GiorgiaMeloni,[],[],"che accoglienza a perugia!
seguite la diretta qui  ","['accoglienza', 'perugia!', 'seguire', 'diretta', 'qui']",accoglienza perugia! seguire diretta qui,joy,"{'neg': 0.0, 'neu': 0.636, 'pos': 0.364, 'compound': 0.3164}",0.0,0.636,0.364,0.3164,positivo
Thu Sep 01 13:49:25 +0000 2022,1565336023307264000,Siamo pronti a dare all’Italia un governo libero e forte. Il 25 settembre scriviamo un capitolo nuovo per la nostra Nazione: scegliete Fratelli d’Italia. https://t.co/Hh4kKKWaky,209,[],Italia,GiorgiaMeloni,[],[],siamo pronti a dare all’italia un governo libero e forte il 25 settembre scriviamo un capitolo nuovo per la nostra nazione scegliete fratelli d’italia ,"['essere', 'pronto', 'dare', 'italia', 'governo', 'libero', 'forte', 'settembre', 'scrivere', 'capitolo', 'nuovo', 'nazione', 'scegliere', 'fratello', 'italia']",essere pronto dare italia governo libero forte settembre scrivere capitolo nuovo nazione scegliere fratello italia,joy,"{'neg': 0.408, 'neu': 0.51, 'pos': 0.081, 'compound': -0.6608}",0.408,0.51,0.081,-0.6608,negativo
Thu Sep 01 07:25:51 +0000 2022,1565239496802705414,"Continueremo a batterci con tutte le nostre forze affinché Chico Forti possa presto tornare in Italia. Lo dobbiamo a lui, a sua figlia e a tutti i suoi cari. https://t.co/XVQR6jSzIN",146,[],Italia,GiorgiaMeloni,[],[],continueremo a batterci con tutte le nostre forze affinché chico forti possa presto tornare in italia lo dobbiamo a lui a sua figlia e a tutti i suoi cari ,"['continuare', 'battere', 'forza', 'affinché', 'chico', 'forte', 'potere', 'presto', 'tornare', 'italia', 'dovere', 'figlia', 'caro']",continuare battere forza affinché chico forte potere presto tornare italia dovere figlia caro,sadness,"{'neg': 0.286, 'neu': 0.238, 'pos': 0.476, 'compound': 0.4588}",0.286,0.238,0.476,0.4588,positivo
Wed Aug 31 18:14:03 +0000 2022,1565040232336064514,"Sul piano sanitario, Speranza ha completamente fallito. Con Fratelli d’Italia e con il centrodestra: istituzione di una commissione d’inchiesta sulla gestione della pandemia e nessuna reintroduzione del Green Pass. Tanto per esser chiari.",1259,[],Italia,GiorgiaMeloni,[],[],sul piano sanitario speranza ha completamente fallito con fratelli d’italia e con il centrodestra istituzione di una commissione d’inchiesta sulla gestione della pandemia e nessuna reintroduzione del green pass tanto per esser chiari ,"['piano', 'sanitario', 'speranza', 'avere', 'completamente', 'fallire', 'fratello', 'italia', 'centrodestra', 'istituzione', 'commissione', 'inchiesto', 'gestione', 'pandemia', 'nessun|nessuna', 'reintroduzione', 'green', 'pass', 'tanto', 'essere', 'chiaro']",piano sanitario speranza avere completamente fallire fratello italia centrodestra istituzione commissione inchiesto gestione pandemia nessun|nessuna reintroduzione green pass tanto essere chiaro,sadness,"{'neg': 0.351, 'neu': 0.456, 'pos': 0.193, 'compound': -0.5399}",0.351,0.456,0.193,-0.5399,negativo
Wed Aug 31 17:25:51 +0000 2022,1565028105655357441,"Nonostante la pioggia, anche a Pescara tanta gente in piazza ad ascoltare i programmi di Fratelli d’Italia per risollevare la Nazione. 
Grazie! https://t.co/RJRZUdC4Un",170,[],Italia,GiorgiaMeloni,[],[],"nonostante la pioggia anche a pescara tanta gente in piazza ad ascoltare i programmi di fratelli d’italia per risollevare la nazione 
grazie! ","['nonostante', 'pioggia', 'pescara', 'tanto', 'gente', 'piazza', 'ascoltare', 'programma', 'fratello', 'italia', 'risollevare', 'nazione', 'grazia!']",nonostante pioggia pescara tanto gente piazza ascoltare programma fratello italia risollevare nazione grazia!,joy,"{'neg': 0.123, 'neu': 0.614, 'pos': 0.263, 'compound': 0.3164}",0.123,0.614,0.263,0.3164,positivo
Wed Aug 31 14:48:44 +0000 2022,1564988565922144256,Brava @BeatriceVenezi. La dimostrazione che chi non è allineato con la sinistra viene sistematicamente fatto oggetto di linciaggio per le sue idee. È inaccettabile. https://t.co/VTMlYFJPO6,159,"[{'screen_name': 'BeatriceVenezi', 'name': 'Beatrice Venezi', 'id': 1416527721497235459, 'id_str': '1416527721497235459', 'indices': [6, 21]}]",Italia,GiorgiaMeloni,[],['BeatriceVenezi'],brava  la dimostrazione che chi non è allineato con la sinistra viene sistematicamente fatto oggetto di linciaggio per le sue idee è inaccettabile ,"['bravo', 'dimostrazione', 'essere', 'allineare', 'sinistra', 'venire', 'sistematicamente', 'fare', 'oggetto', 'linciaggio', 'idea', 'essere', 'inaccettabile']",bravo dimostrazione essere allineare sinistra venire sistematicamente fare oggetto linciaggio idea essere inaccettabile,anger,"{'neg': 0.238, 'neu': 0.19, 'pos': 0.571, 'compound': 0.7184}",0.238,0.19,0.571,0.7184,positivo
Wed Aug 31 13:35:23 +0000 2022,1564970106043744256,"In queste settimane abbiamo assistito a montature e mistificazioni di ogni tipo sui nostri punti programmatici. Da oggi ciascuno di voi può consultare il vero programma elettorale di Fratelli d’Italia. 

Aiutateci a farlo conoscere e girare ⤵️
https://t.co/IRBleo8Bcy https://t.co/Ct0D93uqAC",164,[],Italia,GiorgiaMeloni,[],[],"in queste settimane abbiamo assistito a montature e mistificazioni di ogni tipo sui nostri punti programmatici da oggi ciascuno di voi può consultare il vero programma elettorale di fratelli d’italia 

aiutateci a farlo conoscere e girare  ","['settimana', 'avere', 'assistere', 'montatura', 'mistificazione', 'ogni', 'tipo', 'punto', 'programmatico', 'oggi', 'ciascuno', 'potere', 'consultare', 'vero', 'programma', 'elettorale', 'fratello', 'italia', 'aiutare', 'fare', 'conoscere', 'girare']",settimana avere assistere montatura mistificazione ogni tipo punto programmatico oggi ciascuno potere consultare vero programma elettorale fratello italia aiutare fare conoscere girare,anger,"{'neg': 0.183, 'neu': 0.305, 'pos': 0.512, 'compound': 0.7795}",0.183,0.305,0.512,0.7795,positivo
Wed Aug 31 09:13:53 +0000 2022,1564904296189157377,Continua il nostro tour per parlare dei programmi di Fratelli d’Italia. Ci vediamo a Termoli e a Pescara. https://t.co/uLX2z09Fub,112,[],Italia,GiorgiaMeloni,[],[],continua il nostro tour per parlare dei programmi di fratelli d’italia ci vediamo a termoli e a pescara ,"['continuare', 'tour', 'parlare', 'programma', 'fratello', 'italia', 'vedere', 'termoli', 'pescara']",continuare tour parlare programma fratello italia vedere termoli pescara,joy,"{'neg': 0.364, 'neu': 0.636, 'pos': 0.0, 'compound': -0.4588}",0.364,0.636,0.0,-0.4588,negativo
Tue Aug 30 18:28:42 +0000 2022,1564681532236783616,Grazie Cosenza! https://t.co/1zdhtiTxf6,450,[],Italia,GiorgiaMeloni,[],[],grazie cosenza! ,"['grazie', 'cosenza!']",grazie cosenza!,joy,"{'neg': 0.0, 'neu': 0.304, 'pos': 0.696, 'compound': 0.3164}",0.0,0.304,0.696,0.3164,positivo
Tue Aug 30 17:31:31 +0000 2022,1564667142552838145,"Cosenza ora!
Seguite la diretta qui ⤵️
https://t.co/tAIr8Pw0Az https://t.co/GkD6kIomQA",160,[],Italia,GiorgiaMeloni,[],[],"cosenza ora!
seguite la diretta qui  ","['cosenza', 'ora!', 'seguire', 'diretta', 'qui']",cosenza ora! seguire diretta qui,joy,"{'neg': 0.364, 'neu': 0.636, 'pos': 0.0, 'compound': -0.3164}",0.364,0.636,0.0,-0.3164,negativo
Tue Aug 30 13:33:50 +0000 2022,1564607327067684864,"Alle polemiche strumentali, i cittadini continuano a preferire chi parla di programmi che sappiano rispondere concretamente ai problemi che vivono ogni giorno. Uniti per dare a questa Nazione un governo forte e coeso che metta al centro della sua azione le esigenze degli italiani https://t.co/YIzNknHGAv",195,[],Italia,GiorgiaMeloni,[],[],alle polemiche strumentali i cittadini continuano a preferire chi parla di programmi che sappiano rispondere concretamente ai problemi che vivono ogni giorno uniti per dare a questa nazione un governo forte e coeso che metta al centro della sua azione le esigenze degli italiani ,"['polemica', 'strumentale', 'cittadino', 'continuare', 'preferire', 'parlare', 'programma', 'sapere', 'rispondere', 'concretamente', 'problema', 'vivere', 'ogni', 'giorno', 'unire', 'dare', 'nazione', 'governo', 'forte', 'coeso', 'mettere', 'centro', 'azione', 'esigenza', 'italiano']",polemica strumentale cittadino continuare preferire parlare programma sapere rispondere concretamente problema vivere ogni giorno unire dare nazione governo forte coeso mettere centro azione esigenza italiano,anger,"{'neg': 0.402, 'neu': 0.326, 'pos': 0.272, 'compound': -0.4252}",0.402,0.326,0.272,-0.4252,negativo
Tue Aug 30 07:56:43 +0000 2022,1564522487752413185,"#Pronti a difendere l’ambiente e la bellezza della nostra terra in modo serio, coerente, libero e innovativo, senza pregiudizi verso lo sviluppo economico e le nuove tecnologie. A cominciare dalla difesa del bene naturale per eccellenza: l’acqua.
#ChiAmaLaPatriaDifendelAmbiente https://t.co/EmJgOMlsHA",150,[],Italia,GiorgiaMeloni,"['Pronti', 'ChiAmaLaPatriaDifendelAmbiente']",[],a difendere l’ambiente e la bellezza della nostra terra in modo serio coerente libero e innovativo senza pregiudizi verso lo sviluppo economico e le nuove tecnologie a cominciare dalla difesa del bene naturale per eccellenza l’acqua  ,"['difendere', 'ambiente', 'bellezza', 'terra', 'modo', 'serio', 'coerente', 'libero', 'innovativo', 'senza', 'pregiudizio', 'verso', 'sviluppo', 'economico', 'nuovo', 'tecnologia', 'cominciare', 'difesa', 'bene', 'naturale', 'eccellenza', 'acqua']",difendere ambiente bellezza terra modo serio coerente libero innovativo senza pregiudizio verso sviluppo economico nuovo tecnologia cominciare difesa bene naturale eccellenza acqua,anger,"{'neg': 0.312, 'neu': 0.161, 'pos': 0.527, 'compound': 0.7184}",0.312,0.161,0.527,0.7184,positivo
