created,id,testo,rt,rt_names,location,cluster,hashtag,mention,text_clean,tokenized_text,sentiment_text,emotion,sentiment,neg,neu,pos,compound,new_sent
Wed Aug 31 08:07:37 +0000 2022,1564887618827042821,"Una preghiera per Lady Diana, Principessa amata dal popolo. Ha vissuto in prima linea impegnandosi per la sicurezza internazionale, contro le guerre e per la difesa dei diritti dei bambini. https://t.co/U9MepdlX8B",65,[],,MatteoSalvini,[],[],una preghiera per lady diana principessa amata dal popolo ha vissuto in prima linea impegnandosi per la sicurezza internazionale contro le guerre e per la difesa dei diritti dei bambini ,"['preghiera', 'lady', 'diana', 'principessa', 'amare', 'popolo', 'avere', 'vivere', 'primo', 'linea', 'impegnare', 'sicurezza', 'internazionale', 'guerra', 'difesa', 'diritto', 'bambino']",preghiera lady diana principessa amare popolo avere vivere primo linea impegnare sicurezza internazionale guerra difesa diritto bambino,sadness,"{'neg': 0.209, 'neu': 0.174, 'pos': 0.617, 'compound': 0.8266}",0.209,0.174,0.617,0.8266,positivo
Tue Aug 30 22:16:18 +0000 2022,1564738812466585600,"#Salvini: noi siamo con i Paesi liberi, democratici, occidentali e contro le guerre e contro le dittature. #portaaporta",42,[],,MatteoSalvini,"['Salvini', 'portaaporta']",[],noi siamo con i paesi liberi democratici occidentali e contro le guerre e contro le dittature ,"['essere', 'paese', 'libero', 'democratico', 'occidentale', 'guerra', 'dittatura']",essere paese libero democratico occidentale guerra dittatura,anger,"{'neg': 0.38, 'neu': 0.285, 'pos': 0.334, 'compound': -0.1241}",0.38,0.285,0.334,-0.1241,negativo
Tue Aug 30 22:15:39 +0000 2022,1564738645508112386,"#Salvini: Che bello se l'Italia fosse il primo Paese in Europa a riconoscere Gerusalemme capitale di Israele, una città aperta, dove convivono fedi religiose diverse. L'avevano promessa anche i Democratici Usa. #portaaporta",70,[],,MatteoSalvini,"['Salvini', 'portaaporta']",[],che bello se l italia fosse il primo paese in europa a riconoscere gerusalemme capitale di israele una città aperta dove convivono fedi religiose diverse l avevano promessa anche i democratici usa ,"['bello', 'italia', 'essere', 'primo', 'paese', 'europa', 'riconoscere', 'gerusalemme', 'capitale', 'israele', 'città', 'aperto', 'convivere', 'fede', 'religioso', 'diverso', 'avere', 'promettere', 'democratico', 'uso']",bello italia essere primo paese europa riconoscere gerusalemme capitale israele città aperto convivere fede religioso diverso avere promettere democratico uso,joy,"{'neg': 0.248, 'neu': 0.311, 'pos': 0.441, 'compound': 0.5553}",0.248,0.311,0.441,0.5553,positivo
Tue Aug 30 21:57:36 +0000 2022,1564734102556868609,"#Salvini: cito @TheEconomist: ""sanzioni contro la Russia stanno sortendo il risultato contrario"": il Paese cresce e ha un avanzo di 70mld di $, mentre Italia e Ue si stanno svenando. Cambiamo obiettivo, l'Europa sta punendo se stessa. #portaaporta",137,"[{'screen_name': 'TheEconomist', 'name': 'The Economist', 'id': 5988062, 'id_str': '5988062', 'indices': [15, 28]}]",,MatteoSalvini,"['Salvini', 'portaaporta']",['TheEconomist'],cito  sanzioni contro la russia stanno sortendo il risultato contrario  il paese cresce e ha un avanzo di 70mld di  mentre italia e ue si stanno svenando cambiamo obiettivo l europa sta punendo se stessa ,"['citare', 'sanzione', 'russia', 'stare', 'sortire', 'risultato', 'contrario', 'paese', 'crescere', 'avere', 'avanzo', '70mld', 'mentre', 'italia', 'ue', 'stare', 'svenare', 'cambiare', 'obiettivo', 'europa', 'stare', 'punire', 'stesso']",citare sanzione russia stare sortire risultato contrario paese crescere avere avanzo 70mld mentre italia ue stare svenare cambiare obiettivo europa stare punire stesso,anger,"{'neg': 0.416, 'neu': 0.356, 'pos': 0.228, 'compound': -0.6499}",0.416,0.356,0.228,-0.6499,negativo
Tue Aug 30 21:56:17 +0000 2022,1564733773316591616,"#Salvini a #Vespa: ""Pentito della caduta del governo?"". La domanda deve farla a Conte e Letta, ha sbagliato ospite. Conte ha tolto fiducia al governo e Letta ha detto ""Senza i cinque stelle non vado avanti""... #portaaporta",64,[],,MatteoSalvini,"['Salvini', 'Vespa', 'portaaporta']",[],a  pentito della caduta del governo  la domanda deve farla a conte e letta ha sbagliato ospite conte ha tolto fiducia al governo e letta ha detto senza i cinque stelle non vado avanti   ,"['pentito', 'caduta', 'governo', 'domanda', 'dovere', 'fare', 'conta|conte', 'letta', 'avere', 'sbagliare', 'ospite', 'conta|conte', 'avere', 'togliere', 'fiducia', 'governo', 'letta', 'avere', 'dire', 'senza', 'cinque', 'stella', 'andare', 'avanti']",pentito caduta governo domanda dovere fare conta|conte letta avere sbagliare ospite conta|conte avere togliere fiducia governo letta avere dire senza cinque stella andare avanti,anger,"{'neg': 0.371, 'neu': 0.301, 'pos': 0.328, 'compound': -0.1507}",0.371,0.301,0.328,-0.1507,negativo
Tue Aug 30 21:55:07 +0000 2022,1564733481283985408,"#Salvini: Energia. Qualche mio collega non ha capito che ci sono famiglie, imprese, negozi, fabbriche che salteranno a settembre. Serve subito un accordo di tutta la politica: occorre trovare non meno di 30mld adesso per evitare un'ecatombe. Luce e gas non aspettano #portaaporta",31,[],,MatteoSalvini,"['Salvini', 'portaaporta']",[],energia qualche mio collega non ha capito che ci sono famiglie imprese negozi fabbriche che salteranno a settembre serve subito un accordo di tutta la politica occorre trovare non meno di 30mld adesso per evitare un ecatombe luce e gas non aspettano ,"['energia', 'qualche', 'collega', 'avere', 'capire', 'essere', 'famiglia', 'impresa', 'negozio', 'fabbrica', 'saltare', 'settembre', 'servire', 'subito', 'accordo', 'politica', 'occorrere', 'trovare', 'meno', '30mld', 'adesso', 'evitare', 'ecatombe', 'luce', 'gas', 'aspettare']",energia qualche collega avere capire essere famiglia impresa negozio fabbrica saltare settembre servire subito accordo politica occorrere trovare meno 30mld adesso evitare ecatombe luce gas aspettare,sadness,"{'neg': 0.37, 'neu': 0.185, 'pos': 0.445, 'compound': 0.3074}",0.37,0.185,0.445,0.3074,positivo
Tue Aug 30 21:53:20 +0000 2022,1564733031507689474,"#Salvini: Bisogna bloccare gli aumenti delle bollette di luce e gas, e non dovrà essere il nuovo governo a farlo, non c'è tempo, spero che già nelle prossime ore Esecutivo in carica e Parlamento si attivino: rischiamo una strage di posti di lavoro. #portaaporta",35,[],,MatteoSalvini,"['Salvini', 'portaaporta']",[],bisogna bloccare gli aumenti delle bollette di luce e gas e non dovrà essere il nuovo governo a farlo non c è tempo spero che già nelle prossime ore esecutivo in carica e parlamento si attivino rischiamo una strage di posti di lavoro ,"['bisognare', 'bloccare', 'aumento', 'bolletta', 'luce', 'gas', 'dovere', 'essere', 'nuovo', 'governo', 'fare', 'essere', 'tempo', 'sperare', 'già', 'prossimo', 'ora', 'esecutivo', 'carica', 'parlamento', 'attivare', 'rischiare', 'strage', 'posto', 'lavoro']",bisognare bloccare aumento bolletta luce gas dovere essere nuovo governo fare essere tempo sperare già prossimo ora esecutivo carica parlamento attivare rischiare strage posto lavoro,anger,"{'neg': 0.458, 'neu': 0.289, 'pos': 0.252, 'compound': -0.7022}",0.458,0.289,0.252,-0.7022,negativo
Tue Aug 30 21:48:50 +0000 2022,1564731896323530753,#Salvini: La prima cosa che farei al governo? Reintrodurre i #decretisicurezza. #portaaporta,86,[],,MatteoSalvini,"['Salvini', 'decretisicurezza', 'portaaporta']",[],la prima cosa che farei al governo reintrodurre i  ,"['primo', 'cosa', 'fare', 'governo', 'reintrodurre']",primo cosa fare governo reintrodurre,anger,"{'neg': 0.0, 'neu': 0.25, 'pos': 0.75, 'compound': 0.6124}",0.0,0.25,0.75,0.6124,positivo
Tue Aug 30 21:33:05 +0000 2022,1564727933188685824,"In diretta su Rai 1 da Bruno Vespa, fatemi compagnia!

#25settembrevotoLega, io ci #credo! https://t.co/lKnnV4BC3E",51,[],,MatteoSalvini,"['25settembrevotoLega', 'credo']",[],"in diretta su rai 1 da bruno vespa fatemi compagnia!

 io ci! ","['diretta', 'rai', 'bruno', 'vespa', 'fare', 'compagnia!', 'ci!']",diretta rai bruno vespa fare compagnia! ci!,joy,"{'neg': 0.364, 'neu': 0.273, 'pos': 0.364, 'compound': 0.0}",0.364,0.273,0.364,0.0,neutrale
Tue Aug 30 20:59:33 +0000 2022,1564719494177738761,"Ci lascia un uomo che ha lasciato un segno importante nel secolo scorso, buon viaggio.
#Gorbaciov

https://t.co/MF3JOLhTfK",50,[],,MatteoSalvini,['Gorbaciov'],[],"ci lascia un uomo che ha lasciato un segno importante nel secolo scorso buon viaggio 

","['lasciare', 'uomo', 'avere', 'lasciare', 'segno', 'importante', 'secolo', 'scorso', 'buon', 'viaggio']",lasciare uomo avere lasciare segno importante secolo scorso buon viaggio,sadness,"{'neg': 0.46, 'neu': 0.115, 'pos': 0.426, 'compound': -0.1507}",0.46,0.115,0.426,-0.1507,negativo
Tue Aug 30 19:08:56 +0000 2022,1564691657425141760,"La sinistra riesce a fare polemica perfino sugli abbracci… Ma basta, siate seri e costruttivi!
#25settembrevotoLega https://t.co/tJOWEo1qAT",56,[],,MatteoSalvini,['25settembrevotoLega'],[],"la sinistra riesce a fare polemica perfino sugli abbracci… ma basta siate seri e costruttivi!
 ","['sinistra', 'riuscire', 'fare', 'polemica', 'perfino', 'abbraccio', 'bastare', 'essere', 'serio', 'costruttivo!']",sinistra riuscire fare polemica perfino abbraccio bastare essere serio costruttivo!,anger,"{'neg': 0.0, 'neu': 0.18, 'pos': 0.82, 'compound': 0.8658}",0.0,0.18,0.82,0.8658,positivo
Tue Aug 30 15:48:57 +0000 2022,1564641330130731013,"Violenza inaccettabile, col sindaco Sala e il PD che non muovono un dito. La Sicurezza tornerà ad essere un Diritto, per tutti. https://t.co/63PfOMHExF",156,[],,MatteoSalvini,[],[],violenza inaccettabile col sindaco sala e il pd che non muovono un dito la sicurezza tornerà ad essere un diritto per tutti ,"['violenza', 'inaccettabile', 'sindaco', 'sala', 'pd', 'muovere', 'dito', 'sicurezza', 'tornare', 'essere', 'diritto']",violenza inaccettabile sindaco sala pd muovere dito sicurezza tornare essere diritto,anger,"{'neg': 0.221, 'neu': 0.307, 'pos': 0.472, 'compound': 0.4763}",0.221,0.307,0.472,0.4763,positivo
Tue Aug 30 13:12:50 +0000 2022,1564602042345312256,"Ottimi ascolti dal bravo Nicola Porro a Quarta Repubblica ieri sera: meglio di quelli fatti registrare da Renzi che era collegato prima di me.
Grazie a tutti voi!
Per ora ci accontentiamo di vincere in tv, ma il 25 settembre vogliamo farlo alle elezioni! #25settembrevotoLega https://t.co/g2RykkFwol",43,[],,MatteoSalvini,['25settembrevotoLega'],[],"ottimi ascolti dal bravo nicola porro a quarta repubblica ieri sera meglio di quelli fatti registrare da renzi che era collegato prima di me grazie a tutti voi!
per ora ci accontentiamo di vincere in tv ma il 25 settembre vogliamo farlo alle elezioni! ","['ottimo', 'ascolto', 'bravo', 'nicola', 'porro', 'quarto', 'repubblica', 'ieri', 'sera', 'meglio', 'fare', 'registrare', 'renzi', 'essere', 'collegare', 'prima', 'me', 'grazia', 'voi!', 'ora', 'accontentare', 'vincere', 'tv', 'settembre', 'volere', 'fare', 'elezione!']",ottimo ascolto bravo nicola porro quarto repubblica ieri sera meglio fare registrare renzi essere collegare prima me grazia voi! ora accontentare vincere tv settembre volere fare elezione!,joy,"{'neg': 0.094, 'neu': 0.382, 'pos': 0.524, 'compound': 0.9169}",0.094,0.382,0.524,0.9169,positivo
Tue Aug 30 10:42:21 +0000 2022,1564564170384736256,"🔵 PROPOSTA DELLA LEGA: VIA IL NUMERO CHIUSO A MEDICINA 

Non costa nulla, premia il merito e lo studio dei nostri ragazzi e contrasta la carenza di medici: è semplice BUONSENSO. 
Io #credo nei giovani Italiani, #25settembrevotoLega! https://t.co/KLGSr91GuX",117,[],,MatteoSalvini,"['credo', '25settembrevotoLega']",[],"proposta della lega via il numero chiuso a medicina 
non costa nulla premia il merito e lo studio dei nostri ragazzi e contrasta la carenza di medici è semplice buonsenso 
io nei giovani italiani ! ","['proposta', 'lega', 'via', 'numero', 'chiuso', 'medicina', 'costare', 'nulla', 'premiare', 'merito', 'studio', 'ragazzo', 'contrastare', 'carenza', 'medico', 'essere', 'semplice', 'buonsenso', 'giovane', 'italiano!']",proposta lega via numero chiuso medicina costare nulla premiare merito studio ragazzo contrastare carenza medico essere semplice buonsenso giovane italiano!,anger,"{'neg': 0.256, 'neu': 0.288, 'pos': 0.457, 'compound': 0.6476}",0.256,0.288,0.457,0.6476,positivo
Tue Aug 30 08:33:10 +0000 2022,1564531660619669506,"Complimenti per il sangue freddo e per la profondità delle tue parole.
L’Italia è onorata e orgogliosa di avere donne e uomini come te al proprio servizio. 🇮🇹
(2/2)",30,[],,MatteoSalvini,[],[],"complimenti per il sangue freddo e per la profondità delle tue parole l’italia è onorata e orgogliosa di avere donne e uomini come te al proprio servizio 
 2 2 ","['complimento', 'sangue', 'freddo', 'profondità', 'parola', 'italia', 'essere', 'onorare', 'orgoglioso', 'avere', 'donna', 'uomo', 'te', 'proprio', 'servizio', '@card@']",complimento sangue freddo profondità parola italia essere onorare orgoglioso avere donna uomo te proprio servizio @card@,joy,"{'neg': 0.165, 'neu': 0.289, 'pos': 0.546, 'compound': 0.7392}",0.165,0.289,0.546,0.7392,positivo
Tue Aug 30 08:33:09 +0000 2022,1564531657759199234,"Vuole buttarsi nel vuoto dopo l’aggressione brutale del compagno. A farla desistere e a salvarle la vita interviene Sonia, Carabiniere: “La vita è un bene troppo prezioso, non sprecarla per un uomo che ti sta umiliando”.
(1/2) https://t.co/IjZIn5asBM",49,[],,MatteoSalvini,[],[],vuole buttarsi nel vuoto dopo l’aggressione brutale del compagno a farla desistere e a salvarle la vita interviene sonia carabiniere “la vita è un bene troppo prezioso non sprecarla per un uomo che ti sta umiliando”  1 2 ,"['volere', 'buttare', 'vuoto', 'dopo', 'aggressione', 'brutale', 'compagno', 'fare', 'desistere', 'salvare', 'vita', 'intervenire', 'sonia', 'carabiniere', '“', 'vita', 'essere', 'bene', 'troppo', 'prezioso', 'sprecare', 'uomo', 'stare', 'umiliare', '”', '@card@']",volere buttare vuoto dopo aggressione brutale compagno fare desistere salvare vita intervenire sonia carabiniere “ vita essere bene troppo prezioso sprecare uomo stare umiliare ” @card@,sadness,"{'neg': 0.359, 'neu': 0.119, 'pos': 0.523, 'compound': 0.7098}",0.359,0.119,0.523,0.7098,positivo
Tue Aug 30 08:21:36 +0000 2022,1564528752620716032,"P.s. Sarò proprio a Piacenza giovedì alle 17, mentre oggi vi aspetto alle 11 a Gela (Caltanissetta), a Cammarata (Agrigento) alle 15 e per finire a Palermo alle 20:30.
Le minacce e gli insulti di qualche idiota mi fanno sorridere😊
#25settembrevotolega (2/2)",25,[],,MatteoSalvini,['25settembrevotolega'],[],"p s sarò proprio a piacenza giovedì alle 17 mentre oggi vi aspetto alle 11 a gela caltanissetta  a cammarata agrigento alle 15 e per finire a palermo alle 20 30 le minacce e gli insulti di qualche idiota mi fanno sorridere
 2 2 ","['p', 's', 'essere', 'proprio', 'piacenza', 'giovedì', 'mentre', 'oggi', 'aspetto', 'gelare', 'caltanissetta', 'cammarata', 'agrigento', 'finire', 'palermo', '@card@', 'minaccia', 'insulto', 'qualche', 'idiota', 'fare', 'sorridere', '@card@']",p s essere proprio piacenza giovedì mentre oggi aspetto gelare caltanissetta cammarata agrigento finire palermo @card@ minaccia insulto qualche idiota fare sorridere @card@,anger,"{'neg': 0.276, 'neu': 0.448, 'pos': 0.276, 'compound': 0.0}",0.276,0.448,0.276,0.0,neutrale
Tue Aug 30 08:21:36 +0000 2022,1564528749927964673,"Manifesti strappati anche a Roma e muri imbrattati con offese a me e alla Lega a Piacenza. Eccoli i veri “democratici”…
(1/2) https://t.co/z6nHD7H3H7",59,[],,MatteoSalvini,[],[],"manifesti strappati anche a roma e muri imbrattati con offese a me e alla lega a piacenza eccoli i veri “democratici”…
 1 2 ","['manifestare', 'strappare', 'roma', 'muro', 'imbrattare', 'offesa', 'me', 'lega', 'piacenza', 'eccoli', 'vero', '“', 'democratico', '”', '@card@']",manifestare strappare roma muro imbrattare offesa me lega piacenza eccoli vero “ democratico ” @card@,anger,"{'neg': 0.222, 'neu': 0.482, 'pos': 0.296, 'compound': 0.0611}",0.222,0.482,0.296,0.0611,positivo
Mon Aug 29 20:00:33 +0000 2022,1564342258362638336,"In diretta con Nicola Porro, su Rete 4😊
Parliamo di emergenza bollette e lavoro, rimanete collegati per ascoltare le proposte della Lega per aiutare famiglie e imprese. Buona serata Amici!

#25settembrevotoLega, io ci #credo! https://t.co/qiOveSVvfv",65,[],,MatteoSalvini,"['25settembrevotoLega', 'credo']",[],"in diretta con nicola porro su rete 4
parliamo di emergenza bollette e lavoro rimanete collegati per ascoltare le proposte della lega per aiutare famiglie e imprese buona serata amici!

 io ci! ","['diretta', 'nicola', 'porro', 'rete', 'parlare', 'emergenza', 'bolletta', 'lavoro', 'rimanere', 'collegare', 'ascoltare', 'proposta', 'lega', 'aiutare', 'famiglia', 'impresa', 'buono', 'serata', 'amico!', 'ci!']",diretta nicola porro rete parlare emergenza bolletta lavoro rimanere collegare ascoltare proposta lega aiutare famiglia impresa buono serata amico! ci!,joy,"{'neg': 0.194, 'neu': 0.356, 'pos': 0.45, 'compound': 0.6391}",0.194,0.356,0.45,0.6391,positivo
Mon Aug 29 19:49:37 +0000 2022,1564339508094566405,"La selezione sarà fisiologica e verrà effettuata in base a voti e capacità all’inizio del secondo anno, addio al quiz modello ruota della fortuna: si premia merito e studio. Costo per lo Stato: zero. Buonsenso? Tanto. Io #credo nei giovani italiani. #25settembrevotoLega (2/2)",28,[],,MatteoSalvini,"['credo', '25settembrevotoLega']",[],la selezione sarà fisiologica e verrà effettuata in base a voti e capacità all’inizio del secondo anno addio al quiz modello ruota della fortuna si premia merito e studio costo per lo stato zero buonsenso tanto io nei giovani italiani  2 2 ,"['selezione', 'essere', 'fisiologico', 'venire', 'effettuare', 'base', 'voto', 'capacità', 'inizio', 'secondo', 'anno', 'addio', 'quiz', 'modello', 'ruota', 'fortuna', 'premiare', 'merito', 'studio', 'costo', 'essere|stare', 'zero', 'buonsenso', 'tanto', 'giovane', 'italiano', '@card@']",selezione essere fisiologico venire effettuare base voto capacità inizio secondo anno addio quiz modello ruota fortuna premiare merito studio costo essere|stare zero buonsenso tanto giovane italiano @card@,anger,"{'neg': 0.158, 'neu': 0.421, 'pos': 0.421, 'compound': 0.7906}",0.158,0.421,0.421,0.7906,positivo
Mon Aug 29 19:49:27 +0000 2022,1564339467481120768,Proposta della Lega per sopperire alla carenza di medici: copiamo il modello francese e cancelliamo il numero chiuso per entrare alla Facoltà di Medicina. Libero accesso alle studentesse e agli studenti che ne fanno domanda. (1/2) https://t.co/b0qKgoFiZe,89,[],,MatteoSalvini,[],[],proposta della lega per sopperire alla carenza di medici copiamo il modello francese e cancelliamo il numero chiuso per entrare alla facoltà di medicina libero accesso alle studentesse e agli studenti che ne fanno domanda  1 2 ,"['proposta', 'lega', 'sopperire', 'carenza', 'medico', 'copiare', 'modello', 'francese', 'cancellare', 'numero', 'chiuso', 'entrare', 'facoltà', 'medicina', 'libero', 'accesso', 'studentessa', 'studente', 'fare', 'domanda', '@card@']",proposta lega sopperire carenza medico copiare modello francese cancellare numero chiuso entrare facoltà medicina libero accesso studentessa studente fare domanda @card@,anger,"{'neg': 0.353, 'neu': 0.235, 'pos': 0.412, 'compound': 0.25}",0.353,0.235,0.412,0.25,positivo
Mon Aug 29 19:36:56 +0000 2022,1564336315180716037,"Non fai ridere, fai pena. Non sei un artista, sei uno sciocchino. Sempre onore alle Forze dell’Ordine! https://t.co/toEIzg55iP",115,[],,MatteoSalvini,[],[],non fai ridere fai pena non sei un artista sei uno sciocchino sempre onore alle forze dell’ordine! ,"['fare', 'ridere', 'fare', 'pena', 'artista', 'scioccare', 'sempre', 'onore', 'forza', 'ordine!']",fare ridere fare pena artista scioccare sempre onore forza ordine!,anger,"{'neg': 0.111, 'neu': 0.249, 'pos': 0.64, 'compound': 0.7581}",0.111,0.249,0.64,0.7581,positivo
Mon Aug 29 19:20:34 +0000 2022,1564332196403486722,"In diretta il mio intervento a Radio 101 per lo speciale elezioni, state con me😊

P.S. Vi aspetto in diretta alle 21:55 ospite da Nicola Porro, non mancate!

#25settembrevotoLega https://t.co/9VaB6ZvZ3t",44,[],,MatteoSalvini,['25settembrevotoLega'],[],"in diretta il mio intervento a radio 101 per lo speciale elezioni state con me

p s vi aspetto in diretta alle 21 55 ospite da nicola porro non mancate!

 ","['diretto', 'intervento', 'radio', 'speciale', 'elezione', 'stare', 'me', 'p', 's', 'aspetto', 'diretta', 'ospite', 'nicola', 'porro', 'mancare!']",diretto intervento radio speciale elezione stare me p s aspetto diretta ospite nicola porro mancare!,joy,"{'neg': 0.758, 'neu': 0.242, 'pos': 0.0, 'compound': -0.8926}",0.758,0.242,0.0,-0.8926,negativo
Mon Aug 29 18:28:01 +0000 2022,1564318973017063424,"Mohammed, Lindita, Fouad: GRAZIE di cuore.
Storie di vera integrazione. Un #Credo d’amore per l’Italia. 🇮🇹
#25settembrevotolega

P.s. Condividi questo video sulla bacheca di qualche sinistro che fa ancora finta di non capire! https://t.co/zTmpaIXPjb",76,[],,MatteoSalvini,"['Credo', '25settembrevotolega']",[],"mohammed lindita fouad grazie di cuore storie di vera integrazione un d’amore per l’italia 


p s condividi questo video sulla bacheca di qualche sinistro che fa ancora finta di non capire! ","['mohammed', 'lindita', 'fouad', 'grazia', 'cuore', 'storia', 'vero', 'integrazione', 'amore', 'italia', 'p', 's', 'condividere', 'video', 'bacheca', 'qualche', 'sinistro', 'fare', 'ancora', 'fingere', 'capire!']",mohammed lindita fouad grazia cuore storia vero integrazione amore italia p s condividere video bacheca qualche sinistro fare ancora fingere capire!,joy,"{'neg': 0.414, 'neu': 0.269, 'pos': 0.317, 'compound': -0.4371}",0.414,0.269,0.317,-0.4371,negativo
Mon Aug 29 16:15:27 +0000 2022,1564285612093480970,"E sarebbe interamente finanziata da fondi privati (!).
Siamo stanchi dei troppi “No” ideologici della sinistra: SI al lavoro, SI alla tutela dell’ambiente e SI al progresso: Io ci #Credo! #25settembrevotoLega (2/2)",32,[],,MatteoSalvini,"['Credo', '25settembrevotoLega']",[],"e sarebbe interamente finanziata da fondi privati ! 
siamo stanchi dei troppi “no” ideologici della sinistra si al lavoro si alla tutela dell’ambiente e si al progresso io ci! 2 2 ","['essere', 'interamente', 'finanziare', 'fondo', 'privato!', 'essere', 'stanco', 'troppo', '“', 'no', '”', 'ideologico', 'sinistra', 'lavoro', 'tutela', 'ambiente', 'progresso', 'ci!', '@card@']",essere interamente finanziare fondo privato! essere stanco troppo “ no ” ideologico sinistra lavoro tutela ambiente progresso ci! @card@,anger,"{'neg': 0.207, 'neu': 0.268, 'pos': 0.524, 'compound': 0.7409}",0.207,0.268,0.524,0.7409,positivo
Mon Aug 29 16:15:26 +0000 2022,1564285608964521984,"Ponte sullo Stretto, è ora di dire di SÌ! 
Un sì convinto ad un’opera fondamentale per unire Sicilia e Calabria, Italia ed Europa. Un’immagine straordinaria della bravura ingegneristica italiana nel mondo che porterebbe posti di lavoro e ridurrebbe l’inquinamento marittimo. (1/2) https://t.co/Ee1AmmfA4c",88,[],,MatteoSalvini,[],[],ponte sullo stretto è ora di dire di sì! un sì convinto ad un’opera fondamentale per unire sicilia e calabria italia ed europa un’immagine straordinaria della bravura ingegneristica italiana nel mondo che porterebbe posti di lavoro e ridurrebbe l’inquinamento marittimo  1 2 ,"['ponte', 'stretto', 'essere', 'ora', 'dire', 'sì!', 'sì', 'convincere', 'operare', 'fondamentale', 'unire', 'sicilia', 'calabria', 'italia', 'europa', 'immagine', 'straordinario', 'bravura', 'ingegneristica', 'italiano', 'mondo', 'portare', 'porre', 'lavoro', 'ridurre', 'inquinamento', 'marittimo', '@card@']",ponte stretto essere ora dire sì! sì convincere operare fondamentale unire sicilia calabria italia europa immagine straordinario bravura ingegneristica italiano mondo portare porre lavoro ridurre inquinamento marittimo @card@,joy,"{'neg': 0.143, 'neu': 0.333, 'pos': 0.524, 'compound': 0.8996}",0.143,0.333,0.524,0.8996,positivo
Mon Aug 29 12:43:37 +0000 2022,1564232303546605568,"Lasciamo alla sinistra divisioni, rabbia e polemiche. Uniti si vince 🇮🇹 https://t.co/pAHLtJU1Tw",750,[],,MatteoSalvini,[],[],lasciamo alla sinistra divisioni rabbia e polemiche uniti si vince ,"['lasciare', 'sinistro', 'divisione', 'rabbia', 'polemica', 'unito', 'vincere']",lasciare sinistro divisione rabbia polemica unito vincere,anger,"{'neg': 0.322, 'neu': 0.081, 'pos': 0.597, 'compound': 0.342}",0.322,0.081,0.597,0.342,positivo
Mon Aug 29 11:11:34 +0000 2022,1564209136400830467,"Letta, lavora con noi per fermare gli aumenti delle bollette di luce e gas. I soldi dai russi li ha presi la sinistra, gli accordi con Putin li ha firmati Letta, non altri. Lavoriamo per l’Italia e gli Italiani, smettetela di fare solo polemica. https://t.co/o0PZlHzZuP",99,[],,MatteoSalvini,[],[],letta lavora con noi per fermare gli aumenti delle bollette di luce e gas i soldi dai russi li ha presi la sinistra gli accordi con putin li ha firmati letta non altri lavoriamo per l’italia e gli italiani smettetela di fare solo polemica ,"['letto', 'lavorare', 'fermare', 'aumento', 'bolletta', 'luce', 'gas', 'soldo', 'russo', 'avere', 'prendere', 'sinistra', 'accordo', 'putin', 'avere', 'firmare', 'leggere', 'altro', 'lavorare', 'italia', 'italiano', 'smettere', 'fare', 'solo', 'polemico']",letto lavorare fermare aumento bolletta luce gas soldo russo avere prendere sinistra accordo putin avere firmare leggere altro lavorare italia italiano smettere fare solo polemico,anger,"{'neg': 0.361, 'neu': 0.284, 'pos': 0.355, 'compound': -0.0648}",0.361,0.284,0.355,-0.0648,negativo
